{
  "$schema": "https://json-schema.org/draft/2020-12/schema",
  "type": "object",
  "required": ["title", "regulation", "effective_date", "summary", "requirements", "action_items"],
  "additionalProperties": false,
  "properties": {
    "title": { "type": "string", "minLength": 1 },
    "regulation": { "type": "string", "minLength": 1 },
    "effective_date": { "type": "string", "minLength": 1 },
    "summary": { "type": "string", "minLength": 1 },
    "requirements": {
      "type": "array",
      "minItems": 1,
      "items": { "type": "string" }
    },
    "action_items": {
      "type": "array",
      "minItems": 1,
      "items": {
        "type": "object",
        "required": ["title"],
        "additionalProperties": false,
        "properties": {
          "title": { "type": "string" },
          "owner": { "type": "string" },
          "due": { "type": "string" },
          "status": { "type": "string", "enum": ["open", "in_progress", "done"] }
        }
      }
    },
    "typst_snippets": {
      "type": "object",
      "additionalProperties": false,
      "properties": {
        "footer_note": { "type": "string", "maxLength": 500 }
      }
    }
  }
}
